sectionHeading,closureBegin,closureEnd,location,impact,closedUntil,isNew,
Closures Scheduled for Thursday August 23,,,,,,,
,,,,,,,
,24 Hrs/Day:,,E Main St between Eastern Ave and Elm Tree Ln,Right lane blocked for construction.,8/31.,,
,24 Hrs/Day:,,E Short St between Eastern Ave and Midland Ave,Street CLOSED for construction.  Detours via Corral St and Main St.,9/28.,,
,24 Hrs/Day:,,Elm Tree Ln between E Main St and E Short St,Roadway CLOSED in both directions for construction.  Detours via Deweese St and Eastern Ave.,8/31.,,
,,,,,,,
,9 a.m. - 3 p.m.:,,Lane Allen Rd between Williamsburg Rd and Traveller Rd,Alternating lane closures for gas line installation.,8/31.,,
,9 a.m. - 3 p.m.:,,Midland Ave between E Main St and Winchester Rd,One lane blocked for electric utility work.,9/7.,,
,9 a.m. - 3 p.m.:,,S Upper St between Pine St and Winslow St,Right lane blocked for construction.,8/24.,,
,9 a.m. - 3 p.m.:,,Versailles Rd between Mason Headley Rd and Winners Cir,Rolling lane closures for overhead electric utility work.,9/27.,,
,9 a.m. - 3 p.m.:,,Wilson Downing Rd between Ridgepoint Run and Camelot Dr,Alternating lane closures for utility installation.,9/14.,,
,9 a.m. - 3 p.m.:,,Chestnut St between E Seventh St and E Fourth St,Alternating lane closures for overhead cable work.,8/24.,,
,9 a.m. - 3 p.m.:,,Chestnut St between E Sixth St and E Seventh St,Alternating lane closures for utility work.,8/31.,,
,9 a.m. - 3 p.m.:,,Church St between N Broadway and N Upper St,Alternating lane closures for overhead cable work.,8/24.,,
,9 a.m. - 3 p.m.:,,E Seventh St between Magnolia Ave and Chestnut St,Alternating lane closures for overhead cable work.,8/24.,,
,9 a.m. - 3 p.m.:,,E Seventh St between Shropshire Ave and Tennessee Ave,Alternating lane closures for overhead cable work.,8/24.,,
,9 a.m. - 3 p.m.:,,Elm Tree Ln between E Fifth St and E Sixth St,Rolling lane closures for overhead cable work.,8/24.,x,
,9 a.m. - 3 p.m.:,,Garden Springs Dr between Lane Allen Rd and Alexandria Dr,Alternating lane closures for milling and paving.,8/23.,,
,9 a.m. - 3 p.m.:,,Harrodsburg Rd between Della Dr and Bob O Link Dr,Alternating lane closures for water utility work.,8/24.,,
,9 a.m. - 3 p.m.:,,Jefferson St at W Second St,Outbound lane blocked for gas line work.,8/24.,,
,9 a.m. - 3 p.m.:,,Jefferson St between W Third St and W Fourth St,Lane closures as needed for water and gas line work.,8/24.,,
,9 a.m. - 3 p.m.:,,Man O War Blvd between Darby Creek Rd and Mapleleaf Dr,Outer loop right lane blocked for new driveway construction.,8/24.,,
,9 a.m. - 3 p.m.:,,Maple Ave between E Sixth St and E Loudon Ave,Rolling lane closures for overhead cable work.,8/24.,,
,9 a.m. - 3 p.m.:,,N Broadway at W Second St,Right lane blocked for utility work.,8/23.,x,
,9 a.m. - 3 p.m.:,,N Broadway between W Loudon Ave and E Seventh St,Alternating lane closures for overhead cable work.,8/24.,x,
,9 a.m. - 3 p.m.:,,N Broadway between W Loudon Ave and W Short St,Alternating lane closures for overhead cable work.,8/24.,,
,9 a.m. - 3 p.m.:,,N Limestone between E Short St and Barr St,Right turn lane blocked for power washing.,10/1.,,
,9 a.m. - 3 p.m.:,,Newtown Pike between W Loudon Ave and W Short St,Inbound right lane blocked for overhead cable work.,8/24.,,
,9 a.m. - 3 p.m.:,,Nicholasville Rd between Alumni Dr and State St,Lane closures as needed for signage repair and installation.,8/24.,x,
,9 a.m. - 3 p.m.:,,Nicholasville Rd between Cherokee Park and Alumni Dr,Rolling lane closures for underground line cleaning.,8/24.,,
,9 a.m. - 3 p.m.:,,Richmond Rd between Holiday Rd and Coys Ln,Lane closures possible for overhead cable work.,8/24.,,
,9 a.m. - 3 p.m.:,,S Mill St between W Maxwell St and Bolivar St,One lane blocked for overhead cable work.,8/24.,,
,9 a.m. - 3 p.m.:,,S Upper St between Church St and E Second St,Alternating lane closures for overhead cable work.,8/24.,,
,9 a.m. - 3 p.m.:,,W Fourth St between Chestnut St and N Martin Luther King Blvd,Alternating lane closures for overhead cable work.,8/24.,,
,9 a.m. - 3 p.m.:,,W High St between S Mill St and Patterson Dr,Left lane blocked for utility installation.,8/31.,,
,9 a.m. - 3 p.m.:,,W Maxwell St between Merino St and S Mill St,Right lane blocked for overhead cable work.,8/24.,,
,9 a.m. - 3 p.m.:,,W Second St between N Upper St and N Limestone,Alternating lane closures for overhead cable work.,8/24.,,
,9 a.m. - 3 p.m.:,,W Short St between Newtown Pike and Jefferson St,Right lane blocked for overhead cable work.,8/24.,,
,9 a.m. - 3 p.m.:,,Wilson Downing Rd between Dartmouth Dr and Brigadoon Pkwy,One lane blocked for water line relocation.,8/31.,,
,9 a.m. - 3 p.m.:,,"Woodland Ave at Central Ave, E High St, E Main St, Ransom Aly",Alternating lane closures for gas line work.,8/31.,,
,,,,,,,
,7 p.m. - 6 a.m.:,,Richmond Rd between New Circle Rd and Chinoe Rd/Holiday Rd,"Alternating lane closures for ADA ramp installation, signal work, and milling/paving.",8/23.,,
,7 p.m. - 6 a.m.:,,New Circle Rd between Newtown Pike and Boardwalk,Inner loop left lane blocked for median work.,8/24.,,
,,,,,,,
,9 p.m. - 6 a.m.:,,I-75S between Scott Co line and 112 MM,Two lanes blocked for milling and paving.,8/23.,,
,,,,,,,
All work is subject to change depending on weather conditions or other unforeseen factors.,,,,,,,
,,,,,,,