sectionHeading,closureBegin,closureEnd,location,impact,closedUntil,isNew
Closures Scheduled for Wednesday 12/27 thru Friday 12/29:,,,,,,
,,,,,,
,24 Hrs/Day:,,Bryan Ave between Meadow Park and Park View Ave,Road closure for construction and utility realignment extended.,6/1.,
,9 a.m. - 3 p.m.:,,W Fourth St between Ross Ave and N Upper St,Westbound lane blocked for water line repair.,1/12.,
,9 a.m. - 3 p.m.:,,Ave of Champions at S Limestone,Alternating lane closures for core drilling.,12/29.,
,9 a.m. - 3 p.m.:,,Winslow St at S Limestone,Alternating lane closures for core drilling.,12/29.,
,,,,,,
,,,,,,
