sectionHeading,closureBegin,closureEnd,location,impact,closedUntil,isNew
Closures Scheduled for Tuesday December 19:,,,,,,
,,,,,,
,24 Hrs/Day:,,Bryan Ave between Meadow Park and Park View Ave,Road closure for construction and utility realignment extended.,6/1.,
,9 a.m. - 3 p.m.:,,W Main St between N Broadway and Felix St,Right lane blocked for sign installation.,12/19.,
,9 a.m. - 3 p.m.:,,E Third St at Elm Tree Ln,Westbound lane blocked for manhole repair.,12/19.,
,9 a.m. - 3 p.m.:,,Winchester Rd at E Loudon Ave,Inbound right lane blocked for street repair.,12/20.,
,,,,,,