sectionHeading,closureBegin,closureEnd,location,impact,closedUntil,isNew,
Closures Scheduled for Monday April 6 thru Friday April 10,,,,,,,
,,,,,,,
,24 Hrs/Day:,,Georgetown Rd between Lima Dr and Mercer Rd,The roadway is down to one lane in each direction for bridge demolition/reconstruction.,Summer 2020.,,
,24 Hrs/Day:,,Ave of Champions between S Limestone and Rose St,Southeastbound lane (toward Rose St) CLOSED for sewer utility work.  Detour via E Maxwell St.,8/14.,,
,24 Hrs/Day:,,Manchester St between Oliver Lewis Way and the RR crossing,Road CLOSED to thru traffic for sanitary sewer project.  Detours in place.  Local traffic allowed and businesses remain open.,5/11.,,
,24 Hrs/Day:,,Bolivar St between S Broadway and S Upper St,The lane toward Upper St closed for sanitary sewer work.,5/22.,,
,24 Hrs/Day:,,Deer Haven Ln between Polo Club Blvd and Wargrave Walk,Road CLOSED for construction.,5/1.,,
,24 Hrs/Day:,,Jefferson St between W High St and Manchester St,Road CLOSED for construction.  Detour via Oliver Lewis Way.,10/10.,,
,24 Hrs/Day:,,W High St between Lexington Center Dr and Merino St,Right lane blocked for crane deliveries.,5/3.,,
,24 Hrs/Day:,,Winslow St between S Limestone and S Upper St,Left lane blocked for construction.,7/3.,,
,24 Hrs/Day:,,Greentree Rd between Willowood Rd and Armstrong Mill Rd,Right turn lane blocked for utility work.,4/28.,,
,24 Hrs/Day:,,Access to VA Leestown Hospital (Sousley Campus),Motorists must use the entrance at the light at the Greendale Rd intersection until further notice.,(until further notice).,,
,,,,,,,
,8 a.m. - 4 p.m.:,,Old Lafayette Ave between Central Ave and E Main St,Alternating lane closures for gas line work.,4/17.,,
,8 a.m. - 4 p.m.:,,Ash St between Georgetown St and Charles Ave,Alternating lane closures for utility work.,5/1.,,
,8 a.m. - 4 p.m.:,,Central Ave between Clay Ave and Kentucky Ave,One lane blocked for gas line replacements.,4/17.,,
,8 a.m. - 4 p.m.:,,Gladman Way between Man O War Blvd and Wellington Way,Alternating lane closures for ADA sidewalk installation.,4/10.,,
,,,,,,,
,9 a.m. - 3 p.m.:,,E Main St between Esplanade and N Martin Luther King Blvd,Right lane blocked for underground utility work.,4/8.,,
,9 a.m. - 3 p.m.:,,E Vine St between S Limestone and Hernando Aly,Right lane blocked for electric utility work.,4/20.,,
,9 a.m. - 3 p.m.:,,Man O War Blvd between Nicholasville Rd and Grassy Creek Dr,Alternating lane closures for pavement crack sealing.,4/13.,,
,9 a.m. - 3 p.m.:,,Newtown Pike between W Main St and W Fourth St,Left lanes closed in both directions for concrete median removal.,4/30.,,
,9 a.m. - 3 p.m.:,,Versailles Rd between Oliver Lewis Way and New Circle Rd,Outbound right lane rolling closures for overhead electric utility work.,4/17.,,
,9 a.m. - 3 p.m.:,,Virginia Ave at S Limestone,Outbound right lane blocked for construction.,4/24.,,
,,,,,,,
All work is subject to change depending on weather conditions or other unforeseen factors.,,,,,,,
,,,,,,,