sectionHeading,closureBegin,closureEnd,location,impact,closedUntil,isNew
Closures Scheduled for Friday December 22:,,,,,,
,,,,,,
,24 Hrs/Day:,,Bryan Ave between Meadow Park and Park View Ave,Road closure for construction and utility realignment extended.,6/1.,
,9 a.m. - 3 p.m.:,,W Fourth St between Ross Ave and N Upper St,Westbound lane blocked for water line repair.,1/12.,
,9 a.m. - 3 p.m.:,,E Main St at Clay Ave,One outbound lane blocked for underground cable work.,12/22.,
,9 a.m. - 3 p.m.:,,S Upper St between Winslow St and Bolivar St,Alternating lane closures for directional boring.,12/22.,x
,9 a.m. - 4 p.m.:,,Russell Cave Rd between Iron Works Pike and Elkhorn Creek Bridge,Alternating lane closures for strip patching operations.,12/22.,x
,,,,,,