sectionHeading,closureBegin,closureEnd,location,impact,closedUntil,isNew,
Closures Scheduled for Wednesday February 21:,,,,,,,
,,,,,,,
,9 a.m. - 3 p.m.:,,W Fourth St between N Upper St and Ross Ave,Westbound lane blocked for water line replacement.  Parking lane used as traffic lane.,3/21.,,
,9 a.m. - 3 p.m.:,,E Main St between Eastern Ave and Elm Tree Ln,Right lane closed for water line installation,2/23.,,
,9 a.m. - 3 p.m.:,,N Martin Luther King Blvd at E Fifth St,Alternating lane closures for water line repair.,2/22.,,
,9 a.m. - 3 p.m.:,,Water St between Quality St and Ayres Aly,One lane blocked at a time for underground electrical work.,2/23.,x,
,,,,,,,