sectionHeading,closureBegin,closureEnd,location,impact,closedUntil,isNew,
Lane Closures Scheduled for Friday February 24,,,,,,,
,,,,,,,
,24 Hrs/Day:,,Jacks Creek Pike at Kentucky River Pkwy,Roadway closed for emergency roadway repairs.,(until further notice).,,
,,,,,,,
,4 a.m. Thursday - 8 p.m. Friday:,,Georgetown Rd at Nandino Blvd,Outbound right lane blocked for road repairs.,2/24.,,
,4 a.m. Thursday - 8 p.m. Friday:,,Georgetown Rd at Mercer Rd,Inbound right turn lane to Mercer Rd blocked for road repairs.,2/24.,,
,,,,,,,
,8 a.m. - 4 p.m.:,,Bold Bidder Dr at Canonero Dr and Personality Ct,Single lane closures at each intersection for water line work.,2/28.,,
,,,,,,,
,9 a.m. - 2 p.m.:,,Woodland Ave between E Maxwell St and E Main St,Alternating lane closures for milling and paving.,3/7.,,
,,,,,,,
,9 a.m. - 3 p.m.:,,S Forbes Rd between Versailles Rd and Manchester St,One lane blocked for water line work.,3/15.,,
,9 a.m. - 3 p.m.:,,Ave of Champions and Winslow St between Rose St and S Upper St,Rolling lane closures for underground utility work.,3/10.,,
,9 a.m. - 3 p.m.:,,E High St between Ransom Ave and Rose St,Left lane blocked for gas line work.,3/3.,,
,9 a.m. - 3 p.m.:,,Euclid Ave between Woodland Ave and Rose St,Rolling single lane closures for underground utility work.,3/10.,,
,9 a.m. - 3 p.m.:,,Jefferson St between W Sixth St and W Fifth St,Single lane closures for gas line work.,2/24.,,
,9 a.m. - 3 p.m.:,,Man O War Blvd between Ft Harrods Dr and Versailles Rd,Inner loop right lane blocked for construction.,3/3.,,
,9 a.m. - 3 p.m.:,,Russell Cave Rd between Faith St and Kees Rd,Single alternating lane closures for utility work.,3/3.,,
,9 a.m. - 3 p.m.:,,S Broadway at Gibson Ave,One lane blocked for underground utility work.,2/28.,,
,9 a.m. - 3 p.m.:,,Versailles Rd at S Forbes Rd,Outbound right lane blocked for gas line repairs.,3/3.,x,
,9 a.m. - 3 p.m.:,,W Vine St between S Broadway and Quality St,Rolling single lane closures for underground electric utility work.,2/24.,,
,9 a.m. - 3 p.m.:,,W Vine St between S Mill St and S Upper St,Right lane blocked for water line work.,2/27.,,
,9 a.m. - 3 p.m.:,,Walton Ave between Boonesboro Ave and National Ave,One lane blocked for gas line work.,3/3.,,
,9 a.m. - 3 p.m.:,,Chinoe Rd at Alumni Dr,One lane blocked for sidewalk construction.,2/24.,,
,9 a.m. - 3 p.m.:,,Pleasant Ridge Dr at Bryant Rd,Alternating lane closures for utility work.,3/3.,,
,9 a.m. - 3 p.m.:,,River Park Dr between Centre Pkwy and Armstrong Mill Rd,One lane blocked for road restoration following water line repairs.,3/10.,,
,9 a.m. - 3 p.m.:,,Stratford Dr at Clays Mill Rd,One lane blocked near Clays Mill Rd for utility work.,3/9.,,
,,,,,,,
Work subject to change depending on weather or other unforeseen factors.,,,,,,,
,,,,,,,